id,crawled,title,Original content,pageviews
9546141,2016-01-01T04:47:00+00:00,Kanye West Releases Awful New Song on New YearÉ??s Eve,Is Drake inside Kanye WestÉ??s head? ThatÉ??s the impression one gets after listening to É??FactsÉ?ù a schizophrenic new song Yeezy released onto his SoundCloud page a few hours before the New YearÉ??s Eve ball drop. A sample of the chorus to FatherÉ??s ChildrenÉ??s 1989 ditty É??Dirt and GrimeÉ?ù segues into swirling low-register beats with twinkling ivory accompaniment supplied by producers Metro Boomin and Southside. É??Yeezy Yeezy Yeezy just jumped over É??JumpmanÉ??É?ù raps West mimicking DrakeÉ??s flow on the track É??JumpmanÉ?ù off his bestselling mixtape with Future What a Time to Be Alive. Like É??FactsÉ?ù that tune was produced by Metro BoominÉ??and three of the tracks off WATTBA came courtesy of Southside so here West has decided to reappropriate Drake and FutureÉ??s knob wizards in the service of a long meandering aside about his corporate woes. West has made no secret of his disdain for shoemaker Nike who hosted the release of his Air Yeezys back in 2009 followed by the Air Yeezy IIs. Following the release of his Red Octobers West left Nike furious over his lack of design power and meager compensation for the sneakersÉ??since the brand refused to cut him in on the profitsÉ??and moved over to Adidas. This brings us back to É??FactsÉ?ù parts of which play like a diss track against the swoosh. É??If Nike ainÉ??t had Drizzy man they wouldnÉ??t have nothinÉ??!É?ù West shrieks followed later on by É??IÉ??ve been trending years yÉ??all a couple days. Yeezy in the house and we just got appraised. Nike treat employees just like slaves.É?ù Drake had a huge 2015 with two of his mixtapes hitting No. 1 If YouÉ??re Reading This ItÉ??s Too Late and What a Time to Be Alive. On top of that he made an example out of Nicki MinajÉ??s cabana boy Meek Mill and the silly music video for his É??Hotline BlingÉ?ù went viral boosting the song up the charts. ItÉ??s DrakeÉ??s biggest hit single yet. The Canadian MC also forged lucrative corporate bonds with Apple and Nike and a romantic one with the most dominant athlete alive Serena Williams. Oh and Drizzy grew a beard and got ripped perhaps in an attempt to silence those who feel the hybrid rap/R&B star is softer than a pair of baby thighs. So itÉ??s understandable that despite their lovely moment with Will Smith at DrakeÉ??s OVO Fest Yeezy feels his throne may be in jeopardy. After all the Yeezy Boosts aside WestÉ??s professional 2015 mostly consisted of dropping a bizarre Jedi-inspired fashion line a few forgettable singles joining forces with the flailing Tidal and announcing a pseudo-presidential run at the VMAs. All of this may explain why É??FactsÉ?ù has DrakeÉ??s fingerprints all over it from the sneak-release on SoundCloud to employing the WATTBA producers to sending up DrakeÉ??s flow on É??Jumpman.É?ù Kanye is at his best when heÉ??s angry and inspired not nervous. É??FactsÉ?ù is littered with poorly-conceived rhymes from É??I stuck to my Roots IÉ??m like Jimmy FallonÉ?ù to É??Do anybody feel bad for Bill Cosby? Did he forget the names just like Steve Harvey?É?ùÉ??though referencing HarveyÉ??s Miss Universe flap indicates the track was finished quite recently. The disappointing song does end with a glimmer of hope however with West hinting that he might open his own hotel presumably filled with Le Corbusier lamps. Sign me up. ,29478
9544391,2016-01-01T05:01:00+00:00,Why Everybody Should Work in Hollywood,IÉ??m convinced that working in Hollywood is the most effective and efficient way to teach people how to work. You have to work well under constant pressure. You have to be responsible for more things than anyone should have to be responsible for. And you have to be cunning. IÉ??ve worked in the development and production of major motion pictures and television then switched over to working in content at an advertising agency and now work as a creative director at a media company but in all my travels the most incredible workers were those who got their start in the film & television biz. When I think about the things that make me good at my job I can trace them back to what I learned being at the bottom of the food chain in Hollywood and fighting my way up. HereÉ??s what I learned: There is no other option. If you arenÉ??t good with your time and you canÉ??t stay organized youÉ??ll never make it in this town. ItÉ??s too fast thereÉ??s too much happening and itÉ??s too demanding. You are in the office before your boss and stay long after. You are the manager and keeper of every aspect of their life É?? their schedule their calls their projects their meetings and yes their personal stuff. I had a boss who expected me to make sure their car was always filled with gas. If they ever left the studio and didnÉ??t have enough gas to get where they were going it was my fault (I had to occasionally ask for their keys go to their studio spot turn on their car check for the levels and drive to the gas station if it was low and pray I didnÉ??t crash the car). I knew another assistant who had to always drive their boss to a waxing appointment because they wanted to take a Xanax. Another had to take their bossÉ??s online traffic school for them when they got a ticket. You are their keeper (of their lives and their secrets). And because youÉ??re busy managing their lives your life takes a backseat. I would forget things like friendsÉ?? birthdays or to pay bills. On top of that I also read every incoming script so IÉ??d get in an additional two hours early to make sure I could knock two out before I even started my regular day. I suffered in my first Hollywood assistant gig because everything took me longer than the other assistants at the studio. I pride myself at being an organized person but I didnÉ??t grasp the kind of organized my boss needed me to be É?? it was their office not mine. Not only is there just so much to do and keep track of you need to learn to do it their way. I tried all sorts of methods to help this boss stay organized until we finally came to the conclusion that maybe we just werenÉ??t a match. Our personalities were too different and I was too far down the spiral to be able to pick myself up and come back I felt defeated. It was heartbreaking. I had always been reliable smart efficient and well wanted. And here I was a lowly assistant whose duties I thought I should be able to easily master questioning my work ethic. But it did make me better. I was more prepared to deal with job #2. It was a fresh start and I went in eyes open on learning how to work with a specific kind of personality how to deliver on unique expectations and how to stop negative thinking affect my work. I was a machine at my next job and while that one had a new set of challenges I am still astounded at how much I got done each day. When I moved into other roles at adjacent industries I was SHOCKED to see such poor follow through. Great ideas flowed but the hustle and accountability lacked. When youÉ??re dealing with the desperation and starvation when it comes to Hollywood dreams people will do whatever it takes to get those dreams actualized. I learned that I was the only one responsible for making things happen and no one was going to do that but me. By climbing the ladder of success producing a film or getting a project off the ground I realized the ability to just get things done was an invaluable skill. You have to constantly make decisions and quickly and not fuck up. Should I interrupt Boss in their current meeting that they told me not to interrupt them for but if I donÉ??t theyÉ??ll lose out on this script? High Profile Celebrity is scheduled for a dinner with Boss and when you confirmed the reservation the restaurant didnÉ??t have it and now what? Should I tell Boss they have some personal messages on the answering machine when thereÉ??s a very graphic one a friend sent and if I tell them weÉ??ll both know I heard it but if I donÉ??t will they not get it? Every day. Constantly. Exhaustively. There are choices to be made some important some not so much except in Hollywood itÉ??s all important. Because when you fuck up in Hollywood it makes your life so much more miserable than any other industry because thereÉ??s no room for mistakes. They are unforgivable. The irony: the only way to learn how not to fuck up IS to fuck up. But you also make other decisions a lot faster É?? about yourself. While your peers dawdle for months or years figuring out what theyÉ??re good at or what they love the pressure cooker of Hollywood speeds up that process for you. Because youÉ??re constantly fucking up you figure out quickly how to not fuck up. Since youÉ??re feeling the wrath of fucking up all the time you learn about what kind of boss you want to be in the future (or in my case what kind of boss I absolutely didnÉ??t want to be). And because you figure out what you do and no not want to put up with you make choices about the career you want the work that interests you and the things in your life that matter a lot faster. I once got my dream jobÉ?? or rather what I thought was my dream job except I was in tears every night because my boss at the time was such an awful human and made my life miserable. But that misery taught me a lot the biggest is that I now have a É??no assholeÉ?ù policy. It doesnÉ??t matter the work or the job I now only work with people I enjoy spending time with and for bosses I like and respect. You have to learn every agentÉ??s name and the names of their assistant of the week. You need to know who the current hot writers are their entire body of work and you better have read it all too. You need to remember who É??the peopleÉ?ù are of the celebrities you work with (managers agents PR reps etc) their kidsÉ?? names their birthdays and their blood type. You need to know everyoneÉ??s name on set and have their contact information at the ready. The point is you need to remember volumes and volumes of information. And I donÉ??t mean just have Google at the ready É?? YOU need to be ready. When your boss asks you you have less than a second to respond. No time for you to go digging through your phone or notebook you just have to know. And you know what? You get pretty good at it. I did. I became a sponge. I learned all those names and kept track of who was moving to other agencies or studios. When I worked on sets I made a mini version of the crew list and callsheets laminated them and kept them on a key ring around my neck. I was always ready for whatever information I needed to conjure up in a moment. And I still have a reputation for being a steel trap. I trained my brain to be like that and itÉ??s served me incredibly well. Because of the pace of life (the pressure cooker the harsh hours the personalities) you learn to be detailed and get to the point. Boss canÉ??t be expected to remember everything (thatÉ??s your job É?? see previous point) and has better things to do than talk to you so you are always detailed in your communication. You donÉ??t just say É??your 1pm is hereÉ?ù (the standard time for a Hollywood lunch). You say É??your 1pm lunch with High Profile Celebrity is just pulling up to the lot so theyÉ??re about five minutes out and IÉ??ve laid out lunch in the conference room (and yes no mayo).É?ù You donÉ??t just say youÉ??re almost done with script coverage. You say youÉ??re almost done with É??X script that came in Tuesday by Big Writer and Y script by Lesser Known Writer that came in today and everyone is talking about it so theyÉ??ll have coverage for both by 8pm.É?ù There is no room for follow-up questions that will annoy Boss or for speeches. And if theyÉ??re asking about something? YouÉ??ve already failed. You fucked up. I had a boss that would tell me five times a day É??constant updatesÉ?ù and I have their voice in my head to this day. They wanted to know exactly what was happening with everything throughout the day and if they had to ask they were pissed. I needed to be on the ready and find the moments throughout the day to proactively update them. Speaking of being proactive itÉ??s the game changer in all of this. On my first internship I watched in awe as efficient assistants would organize something because they saw a need for it on top of their mountains of work without being asked. I know that sounds pretty basic but it was a great lesson to learn so young. You werenÉ??t going to get anywhere by doing just whatÉ??s asked of you É?? you need to step it up. Because this is Hollywood and weÉ??re all starving. So be better than the person next to you be indispensable and be proactive when it comes to making your boss and everyone else at the companyÉ??s lives better. See what needs fixing and just FIX IT. I apply the same skills in a senior role when it comes to growing a team growing a business and making things better and more efficient. ItÉ??s also the only way youÉ??re going to get promoted out of that assistant role É?? the only thing that matters. YouÉ??ll put up with screamers manipulators phonies people that get away with shit that makes you look around incredulously at everyone else thatÉ??s allowing them to act that way people that only want to be friends with you because of where you work celebrities you need to function around even if theyÉ??re your heroes and people treating you and hitting on you in ways that would be deemed incredibly unprofessional and liable in any other industry. You let it all roll off you. You have to. Because you tell yourself if youÉ??re miserable for just this one year this one job the payoff will be big. So you endure. Because itÉ??s all a game the most difficult game on the planet. In Hollywood he who lasts the longest makes it. And you realize the fucking up the crazies the long hours and the immense effort it all takesÉ??thatÉ??s what makes you better the best. Because the biggest thing it teaches you is to keep pushing keep fighting keep getting better keep learning. ,24939
9544392,2016-01-01T05:01:00+00:00,Bill Cosby Tamir Rice And The Power of Prosecutors,What do Bill Cosby and Tamir RiceÉ??s have in common? Their cases reveal the immense power of prosecutors. Consider the fact that in 2005 Andrea Constand told police that Bill Cosby gave her drugs and sexually assaulted her. Why wasnÉ??t he charged? The prosecutor didnÉ??t think there was enough evidence. Ten years later Cosby is charged. Why? Partly because of new bits of evidenceÉ??CosbyÉ??s admission that he sometimes gave women drugs in order to have sex with them and at least 50 other accusations against him. But mostly because now thereÉ??s a different prosecutor Kevin Steele. These are judgment calls in 2005 and 2015. Now consider the cases of Tamir Rice Michael Brown and Eric Garner. None of the police officers responsible for their deaths were ever chargedÉ??not convictedÉ??charged. In all three cases prosecutors practically told grand juries not to indict. In Ferguson Robert McCulloch decided to simply present all the evidence to the grand jury rather than make a case against Officer Darren Wilson. In Staten Island Darren Donovan a Republican with extensive ties to the police department failed to secure an indictment against Daniel Pantaleo whose chokehold led to Eric GarnerÉ??s death. And most recently in Cleveland Tim McGinty stated openly that he didnÉ??t believe anyone should be charged in the shooting of 12-year-old Tamir Rice. Set aside for the moment the facts of these cases. WhatÉ??s striking in all of them is that county prosecutors and district attorneys singlehandedly and without oversight decide the fates of the accused. More judgment calls unreviewed and unreviewable. True there is some oversight: most of these prosecutors are elected. If voters donÉ??t like how theyÉ??re doing (or not doing) their jobs they can vote them out of office. Indeed in the case of Bill Cosby then-D.A. Bruce CastorÉ??s decision not to indict in 2005 became an issue in his election battle with Kevin Steele this year. But is this really É??oversightÉ?ù? As The Daily Beast reported last September voters often know next to nothing about the candidates running for positions as prosecutors or judges. Turnout is extremely low especially in off years. And when voters are paying attention they are bamboozled by the only campaign message that seems to work: É??tough on crime.É?ù This year for example Steele ran on his É??98 percent conviction rateÉ?ù and É??tough sentences for sexual predators.É?ù ThatÉ??s what people want right? They see prosecutors as agents of the criminal justice system and everyone wants less crime. This leads to two perverse incentives for prosecutors. First they have an incentive to over-charge criminal defendants and secure convictions more than justice. Second they have an incentive not to charge police officers who after all are fighting crime every day and with whom they work closely on a daily basis. In principle if Officers Pantaleo Wilson and Loehmann violated the law then they are criminals. But in practice they are policemen and perceived as the opposite of criminals. Voters who want to get tough on crime do not want to get tough on cops. So not only is there no meaningful oversight of prosecutors but the oversight that does exist is skewed to specific outcomes and behaviors not impartiality and performance. Now back to Cosby. If you pay close attention to what Steele said this week youÉ??ll notice that he went out of his way to mention the new evidence that has come to light in the last twelve months. É??A prosecutorÉ??s job is to follow the evidence wherever it leads and whenever it comes to lightÉ?ù he said announcing the arrest. In part this was to explain the nearly twelve-year gap between the crime and the charge. But in large part it was to explain why Cosby is being charged in 2015 but wasnÉ??t in 2005. And what is that new evidence? Only what is known as É??habit evidenceÉ?ù: that Cosby admitted to drugging and having sex with other women. But not ConstandÉ??however ludicrous it may seem CosbyÉ??s position is that she consented. Is habit evidence really enough to reopen a closed case and file charges? Again thatÉ??s another judgment call. Like Judge RobrenoÉ??s decision to unseal the damning deposition records SteeleÉ??s decision was basically up to him. Of course Steele chose to make it an election issue as well. HeÉ??d look foolish if having just accused Bruce Castor of doing nothing he did nothing too. But again that was SteeleÉ??s decision. Just as prosecuting É??AmericaÉ??s DadÉ?ù in 2005 might have made Castor loo bad prosecuting AmericaÉ??s Rapist in 2015 makes Steele look good. We imagine that district attorneys and other prosecutors are motivated by truth justice and the American way. But in fact they are elected officials who paint in broad strokes for a mostly-ignorant public who unlike judges cannot be held accountable for their misconduct by oversight boards and who exercise discretion so broad that the disposition of justice often lies entirely within their judgment. Finally of course Tamir Rice and Bill Cosby have more in common than under-zealous prosecutors: both African American males one quite young and one quite old operating in a system in which 95 percent of prosecutors are white and local police forces are 88 percent white. For decades Cosby was protected by his wealth celebrity class and connections particularly at Temple University. But he is the exception not the rule. Black men comprise 6 percent of the U.S. population but 35 percent of the prison population. They receive sentences roughly 10 percent more severe than white defendants convicted of identical crimes. And when they are perceived to be older than they are bigger than they are more dangerous than they are or more violent than they are their 88 percent-white police officers and 95 percent-white-prosecutors exercise É??discretionÉ?ù in remarkably similar ways. The United States is the only country in the world that elects prosecutors based on sloganeering and then holds them to no standard other than majority whim. After nearly 12 years Bill Cosby has indeed been charged with a crime. But only because a prosecutor decided to do soÉ??this time. ,13595
