id,crawled,title,Original content,pageviews
9544387,2016-01-01T05:05:00+00:00,What You Missed While You Were Trumping,One of the most frustrating aspects of the Year of Trump besides everything was the viciously cyclical nature of Trump coverage. Attention and outrage are the fuel of Trumpism and attempts to explain his rise wound up re-inscribing the central falsehood of his campaign: that people are angry about an America in decline and a government with suspect motives and marginal competence. But what if none of that were true? What if people arenÉ??t really angry America isnÉ??t actually in decline and our government is neither malicious nor incompetent? Are people angry? Americans as whole say they are and IÉ??ve been through enough counseling that I hesitate to tell anyone how they feel. But Trump supporters arenÉ??t angry theyÉ??re terrified. There are forms of righteous angerÉ??the kind of communal eruption that happens when there are no other legitimate forms of expression. Trump supporters on the other hand do no lack for legitimate forms of expression. People are asking them what they think and feel all the time. There is not a second of time in the last 600 years that the world has had to guess at what American white people want. Numerous progressive commentators (and Saturday Night Live) have pointed out that the nostalgia inherent in making America great É??againÉ?ù is little more than a pull toward a time before a gaymarriageblackpresidentscarymuslims. As one analyst put it É??Fear is the path to the dark side. Fear leads to anger. Anger leads to hate. Hate leads to suffering.É?ù Is America in decline no longer É??greatÉ?ù? IÉ??m tempted to indulge in a poetic interpretation to delve into the areas of American culture and society that produced greatness on a regular basisÉ??from rescue workers to scientists artists to educators. But Trump (and his supporters) are at once thuddingly literal and immeasurably ambiguous: É??GreatnessÉ?ù seems to be a combination of economic success and world-leader dick-measuring. But if the U.S. has fallen so far in world esteem how come the immigrants that so upset Trumpkins want to come here? Less concretely there are actual data about how the rest of the world views America and itÉ??s largely positiveÉ??we have an overall 65 percent approval rating with some countries giving us the kind of marks that are a distant memory for AmericaÉ??s political class: 75 percent positive opinion in France (France!) 80 percent in both El Salvador and Kenya. Economically well by the measure of the white working-class non-college-educated Trump supporters they are either extremely late to the realization that their wages have stagnated (indeed in real terms the average hourly wage peaked in 1973) orÉ??and weÉ??re happening on a theme hereÉ??the complaint isnÉ??t about the loss of É??greatnessÉ?ù so much as the emergence of a perceived threat to the status quo. I donÉ??t think itÉ??s even about America being less great for them. ItÉ??s an alarm over the possibility that America is becoming great for people who arenÉ??t them. Whether American greatness is in fact becoming more widely accessible is a separate but related questionÉ??and it brings us to the final falsity of the Trumpian theology: Government is both evil and inept. ThereÉ??s no doubt that it can be itÉ??s mostly been evil and inept in the way itÉ??s treated the very people Trumpkins worry about sharing the greatness pie with. Those communities continue to suffer but here is where the Trump theology finds purchase: In 2015 our democracyÉ??the functioning one outside the circus of the party primariesÉ??did a lot right by its citizens. Some old wrongs began to be righted: The death penalty is increasingly unpopular not just in the public eye but with state legislatures and judges. Courts in Texas (Texas!) issued two (two!) death-penalty sentences in all of 2015É??the fewest since re-instating the penalty 40 years ago. Across the country death sentences dropped 33 percent from 2014 with 49 people being sentenced to death this year. By comparison: In 1996 315 people were put on death row. Also in 2015 just six states carried 28 out executions the fewest since 1999É??when 98 people were killed. And while officer-involved shootings continue to be flashpoints for community unrest cities have grabbed on to the Department of JusticeÉ??s best practicesÉ??hard-won lessons from Ferguson Missouri being put to use in places such as my adopted hometown of Minneapolis where the biggest headline of the year might be the riot that didnÉ??t happen in the wake of the death of Jamal Clark. Also this year: Politicians embraced the end of the war on the drugs and the beginning of the movement to aid those in addiction. (A turn of events that may be the only lasting memory of Chris ChristieÉ??s presidential campaign.) Police departments are experimenting with a policy that puts treatment before arrest: In Glouchester Massachusetts addicts who ask police for treatment will be assisted into a programÉ??on the spot. More than 100 have found help so far. At the federal level almost unnoticed this month Congress ended the federal enforcement of drug laws where the state has legalized medical marijuana. Somewhere between old wrongs being righted and new paths forward: The fight to raise the minimum wage continues to catch on among activists and allies in government. In 2015 workers won higher hourly wages in 13 states and in 14 municipalities (PDF). These werenÉ??t just soft-hearted coastal governmentsÉ?? blue bleeding hearts in action either: Michigan and Nebraska went to $15 an hour as well as Missoula Montana Pittsburgh and Buffalo New York. And in more forward-looking changes the Consumer Financial Protection Bureau now in its fifth year has become the exact kind of watchdog-with-teeth Elizabeth Warren envisioned. ItÉ??s taking in a record number of consumer-generated complaints (through November: 749400 24300 in October aloneÉ??more in one month than it saw in all of 2014). AND itÉ??s stepped in on some of the longest-running but legal scams in America cracking down on (and getting huge payouts for consumers from) payday lenders and for-profit colleges. How successful is the CFPB? Its right-wing critics have resorted to fearmongering about the importance of payday loans in the fight against terrorism. This isnÉ??t to say that the year didnÉ??t also see tragedy and horror many instances emerging from governmental abuse or ineptitude but itÉ??s important to remember that the fear that Trump has based his campaign on is not real. The idea that small-d (and occasionally big-d) democratic government works undermines the entire framework of Trumpism. Programs like the CFPB and the slow turn toward true criminal justice are kryptonite to the strongman ideology of Trump not just because it fucks with his message of government incompetence or maliciousness. Its successful tenure is evidence of government for the people to be sure but its existence is also evidence of government by the people. The image of Obama as capricious dictator making social-justice decrees out of pique is TrumpkinsÉ?? favorite myth because it cuts out the part of our American story that they are the least able to explain or process: Obama and Democrats have facilitated these incremental bits of forward progress because they won. They were elected to do so. Grappling with the fact of a functional government requires more than the admission that protecting citizens is legitimate activityÉ??it also forces the argument that government protects and fights for people because thatÉ??s what its people want. The fearful coverage of the TrumpÉ??s fear-filled campaign has created an echo of terror on the left of course. Part alarmist fundraising necessity on the part of Democrats part symptom of a conflict-obsessed media many rational and sane Americans now think that there is a real possibility of Donald Trump will be elected president. I donÉ??t want to encourage complacency by denying the possibility but I do want to remind everyone: WeÉ??re better than that. WeÉ??ve shown ourselves to be better than that. DonÉ??t be afraid. Be aware. ,12562
9544385,2016-01-01T05:08:00+00:00,This Is What Should Happen In The Final Season of É??Downton AbbeyÉ??,So have you managed it? Have you done the reading equivalent of putting your hands over your ears and shouting É??lalalaÉ?ù as someone tries to impart vital information to you? Have you in short defied every intruding tentacle of modern media to ensure you can watch the final season of Downton Abbey in American time rather than British? If so congratulations and I assume you have the cucumber sandwiches pots of tea and dense fruitcake in hand for Sunday nightÉ??s premiere. (TheDaily BeastÉ??s reviews will run after each episode.) Downton Abbey finally finished its life in the UK on Christmas Day and it did so with a flood of articles and reviews none of which will be linked to here. Because lalala. One headline gave something huge away to this reader whose eyes alighted upon the headline before realizing what the headline was. In that split second there was both horror and a determined self-imposed amnesia on what had been seen. Five days later I am again none the wiser. I know nothing. I must know nothing. Do not tell me anything. Lalala. So what do we want for this merry band of poshos their servants and that honey-colored house of intrigue? We left them at the end of season five in various states of romantic and personal chaos. I think itÉ??s not too much of a leap to suggest there is a consensus that Mrs. Hughes and Mr. Carson should indeed proceed happily to the altar. However this is Downton Abbey and as Mrs. Hughes for some reason had a huge where-the-hell-did-that-come-from? speech at the end of season five about having to take care of psychotic relatives perhaps their journey to marital bliss will not come without a bug-eyed sister appearing out of a shadows with a rolling pin. Unless series creator and writer Julian Fellowes has had another idea for them bets must also be placed on who out of Mr. or Mrs. Bates will spend the duration of season six wrongly accused of murder and in jail. Currently itÉ??s Mrs. Bates facing the slammer but this is only until Mr. Bates finds someone evil associated with the case and doesnÉ??t kill them but looks like he does and then he is wrongly accused of it and then ends upÉ?? Unless. Unless. Unless Julian Fellowes can think of something new to put Mr. and Mrs. Bates through which doesnÉ??t involve a wrongful murder accusation. I know. Radical suggestion. Just saying. Similarly: Edith. The ugly duckling child has basically been FellowesÉ?? punching bag since the storyÉ??s start. First it was her plainness and dourness that was bitchily targeted by her glamorous man-magnet older sis. Then Fellowes put Edith through a succession of hurtful humiliating romantic disasters. Then she gave birth to a baby that shame dictated she give away but have near. Then that baby was introduced to her home as an orphan which she would take care of. In season six Edith and Mary will surely both be shown pursuing career-oriented pathsÉ??both very different and both probably derailed by romantic intrigues. How long can Edith or Poor Edith as her many fans know and love her go through this cycle of relentless degradation and having emotional excrement thrown at her? We may want Edith to have a happy endingÉ??I want it more powerfully than I want Mary to have one or Cora to have a full-blooded storyline of her ownÉ??but you sense Fellowes is going to put her through yet more ludicrous wringers to get there. As for Lady Mary she had a bottleneck of posh suitors by the end of last season: handsome chaps with chiseled jaws but all truly dreary and dull. The problem with Mary is that she can never outdo her initial love story with Matthew and the death of Mr. Pamuk. But more men come for her armed with defrosting guns in season six. I want to know nothing else. Lalala. It seems kind of ridiculous that they donÉ??t put her together with Branson her dead sisterÉ??s surviving husband. It is ruining nothing to reveal he is coming back for season six. A good ending must surely be in line for Barrow whom we last saw scheming for good against Lord Sinderby in season five. The formerly total evil closeted gay footman has been softened of lateÉ??and after a dispiriting flirtation with reparative therapy may be set to hold his nascent rainbow flag a little more proudly. Lord Grantham and Cora can only be rocked by something totally unpredictableÉ??even regular viewers have tired of how many times Downton itself can be in perilÉ??although season six will surely open up a new avenue of this perennial favorite. Ever since she slipped on the soap and lost her baby Cora has been storyline-freeÉ??apart from batting her doe eyes in a perfect-hostess wayÉ??until last seasonÉ??s set of brief and ultimately chaste assignations with that art critic played by Richard E. Grant. As for Baxter and Molesley: get them together extend their Hart to Hart-style?ˇdetective work into a fully fledged agency. This leaves posh cuz Rose whom I donÉ??t yet really care about (nice as she is) Mrs. Patmore under siege from more kitchen technology the Countess Dowager (the fierce incomparable Dame Maggie Smith) last seen dispatching a lovelorn Russian aristo back into the arms of his estranged wife and kitchen maid Daisy who wants something better but keeps coming back to scraping potatoes. The barest of things we do know or may care to know going into season six: it is 1925 the estateÉ??yesÉ??is going through yet more change as in a mirror to modern recessionary timesÉ??the high costs of running Downton mean servants may be in the firing line. Texts from friends in LondonÉ??shut up lalalaÉ??suggest that happy endings are in order. But the soft driving winds around Downton have always been about É??changeÉ?? and its imminence and its inevitability. Even when episodes are bad and storylines drift incomprehensibly for months at a timeÉ??as with the BatesÉ??s and their wrongful imprisonmentsÉ??there is still the charm of a soup competition or the parrying banter between the Countess Dowager and Isobel CrawleyÉ??a favorite of this viewers played beautifully by Penelope Wilton. The perfection is in the mix and even when that mix is not perfect there is something in the way Fellowes crafts Downton that keeps fans satiated. The final season of any show however is the hardestÉ??saying goodbye giving the characters the endings that both they deserve and the viewers deserve. For that FellowesÉ??s autocratic stewardship of the show augurs wellÉ??if anyone knows this eclectic maddening loveable group of servers and the served and the both tender and tense yoking that binds them it is Fellowes. Whatever elseÉ??no spoiler thisÉ??he will do right by them. ,20929
9544383,2016-01-01T05:10:00+00:00,É??SherlockÉ?? Sends Benedict Cumberbatch Back in Time to Victorian London,They finally got Benedict CumberbatchÉ??s Sherlock Holmes to put on that iconic deerstalker cap. In an episode from the second series of MasterpieceÉ??s contemporary-set Sherlock the title character impulsively uses the hat most associated with the literary detective to hide his face from the paparazzi. It inadvertently becomes his signature when the photo lands on the front cover of BritainÉ??s tabloids. É??What kind of hat is it anyway?É?ù a frustrated Sherlock wonders. É??Is it a cap? WhyÉ??s it got two fronts?É?ù When Martin FreemanÉ??s Watson informs him that itÉ??s called a É??deerstalkerÉ?ù he adds É??You canÉ??t stalk a deer with that. What are you going to do throw it? Some sort of death frisbee?É?ù He promptly chucks the hat across the room with no intention of ever putting it back on his head. Yet there Cumberbatch is wearing the maligned hat along with more Arthur Conan Doyle-era Victorian period dress in the new Sherlock special É??The Abominable BrideÉ?ù set to premiere simultaneously for the first time in Britain and the U.S. on January 1. There are horse-drawn carriages in the streets of London and a curlicue mustache on John WatsonÉ??s face. ThereÉ??s even an over-sized pipe in HolmesÉ??s mouth. What happened to the modern-day Sherlock viewers have grown to love over the past five years? When period-tinged photos started to leak from the set earlier this year SherlockÉ??s co-creator Steven Moffat was quick to clarify that the change was made for this one-off special only and not a permanent shift in the series. É??The special is its own thingÉ?ù Moffat told Entertainment Weekly in March. É??We wouldnÉ??t have done the story weÉ??re doing and the way weÉ??re doing it if we didnÉ??t have this special. ItÉ??s not part of the run of three episodes. So we had this to do itÉ??as we could hardly concealÉ??itÉ??s Victorian.É?ù He added É??ItÉ??s kind of in its own little bubble.É?ù As for the nature of that story itÉ??s a bit more supernatural than a typical episode of the show which tends to rely on the detectiveÉ??s on-the-spectrum attention to detail along with modern technological advances to solve its convoluted cases. This time weÉ??re dealing with a É??ghost story.É?ù É??Ghost stories work better in a Victorian settingÉ?ù Moffat said recently. É??This strand of Doyle original stories that are creepy and scary and the chillers we havenÉ??t done much with in the modern show. But putting it back into Victorian times you think itÉ??s a chance to do a ghost story reallyÉ??a creepy scary one.É?ù According to MoffatÉ??s co-creator Mark Gatiss who also plays Mycroft Holmes in the series the specialÉ??s title is derived from an off-hand reference Sherlock makes to the case of É??Ricoletti of the club foot and his abominable wifeÉ?ù in DoyleÉ??s short story The Musgrave Ritual. But beyond that small clue the showrunners revealed little else about the plot. Actor Rupert Graves who plays Inspector Lestrade and sports enormous muttonchops as the period version of his character remarked in a behind-the-scenes featurette for the special how everything in the Sherlock world slows down without the benefit of modern technology. É??One of the great things about the modern day Sherlock is the speed with which he can globally get things doneÉ?ù Graves said. É??In this you have to use telegrams and morse and I think that has an atmospheric shift.É?ù Cumberbatch added that the time period transformation did not change much about his character whom he describes as É??very old-fashionedÉ?ù even in a modern setting. É??HeÉ??s very contained in another eraÉ?ù he said. É??So for me it feels weirdly at home for this character.É?ù But the decision to air a one-off special as opposed to kicking off the highly-anticipated fourth series this year likely has more to do with CumberbatchÉ??s demanding schedule than any grand artistic statement. Not only did the actor star in a divisive version of Hamlet this past year but he also had a starring role in Black Mass stirred controversy with his trans character in the upcoming Zoolander 2 and started filming the title role in MarvelÉ??s Doctor Strange. Meanwhile Martin Freeman has been nearly as busy wrapping up the Hobbit series and his role in Fargo while filming next yearÉ??s Whisky Tango Foxtrot alongside Tina Fey and making an appearance in yet another Marvel property Captain America: Civil War. There simply wasnÉ??t time to shoot more than one episode of Sherlock which is certain to disappoint some fans who are anxiously awaiting the resolution of a major cliffhanger from the end of series three. When we last left Holmes he had been banished to Eastern Europe to embark on a mysterious mission after murdering É??the Napoleon of blackmail.É?ù But he is immediately called back to London when it is discovered that his nemesis Moriarty is still alive. Rather than address any of those lingering questions The Abominable Bride transports the characters into the past where they must take on an entirely new case. But it appears that the salty nature of Watson and HolmesÉ?? relationship remains intact. É??YouÉ??re Sherlock Holmes wear the damn hatÉ?ù Watson says at one point shoving the deerstalker into his partnerÉ??s hands. ,34501
